{
  "trace_id": "tr_61e90c121d529b01b24f",
  "created_at": "2026-02-12T08:12:14.186400+00:00",
  "trace_type": "resolve_context",
  "subject": {
    "date": "2026-10-16",
    "profile": "np-mainstream"
  },
  "inputs": {
    "latitude": 27.7172,
    "longitude": 85.324,
    "timezone": "Asia/Kathmandu"
  },
  "outputs": {
    "bs": {
      "year": 2083,
      "month": 6,
      "day": 30,
      "month_name": "Ashwin",
      "confidence": "official",
      "source_range": "2070-2095",
      "estimated_error_days": null
    },
    "tithi": {
      "display_number": 6,
      "paksha": "shukla",
      "name": "Shashthi"
    },
    "observance_count": 1
  },
  "steps": [
    {
      "step_type": "bs_conversion",
      "math_expression": "gregorian_to_bs(date)",
      "output": {
        "year": 2083,
        "month": 6,
        "day": 30,
        "month_name": "Ashwin",
        "confidence": "official",
        "source_range": "2070-2095",
        "estimated_error_days": null
      }
    },
    {
      "step_type": "udaya_tithi",
      "math_expression": "tithi_at_sunrise(date, lat, lon)",
      "output": {
        "display_number": 6,
        "absolute_number": 6,
        "name": "Shashthi",
        "paksha": "shukla",
        "method": "ephemeris_udaya",
        "sunrise_local": "2026-10-16T06:05:44+05:45",
        "sunrise_utc": "2026-10-16T00:20:44+00:00",
        "progress": 0.0916
      }
    },
    {
      "step_type": "festival_resolution",
      "math_expression": "rules.on_date(date)",
      "output": {
        "count": 1
      }
    }
  ],
  "provenance": {
    "generated_at": "2026-02-12T08:12:14.186343+00:00",
    "source": "resolve_endpoint_v5_track"
  }
}